{
  "id": "boundbonepro",
  "type": "square",
  "enabled": true,
  "weight": 1,
  "priority": 0,
  "schedule": {
    "start": null,
    "end": null
  },
  "creative": {
    "image": "c55329cc-ff77-44b9-8f59-3c604ee54529.png",
    "width": 728,
    "height": 90,
    "alt": "BoundBonePro",
    "text": "あなたのアバターをもっとリアルに！揺れを簡単に追加するアドオン！",
    "cta": null
  },
  "clickUrl": "https://ajisaiflow.booth.pm/items/8025925",
  "analytics": {
    "ga": {
      "impressionEvent": "ad_impression",
      "clickEvent": "ad_click",
      "params": {
        "ad_id": "sample-winray",
        "campaign": "sample"
      }
    }
  }
}
