{
  "id": "sample-winray",
  "type": "banner",
  "enabled": true,
  "weight": 1,
  "priority": 0,
  "schedule": { "start": null, "end": null },
  "creative": {
    "image": "banner.svg",
    "width": 728,
    "height": 90,
    "alt": "AdFlow サンプルバナー",
    "text": null,
    "cta": null
  },
  "clickUrl": "https://github.com/lighfu/adflow-content?utm_source=adflow&utm_medium=winray&utm_campaign=sample",
  "analytics": {
    "ga": {
      "impressionEvent": "ad_impression",
      "clickEvent": "ad_click",
      "params": { "ad_id": "sample-winray", "campaign": "sample" }
    }
  }
}
